{
  "$schema": "./schema.json",
  "name": "Default",
  "author": "shadcn",
  "url": "https://ui.shadcn.com",
  "modes": {
    "light": {
      "name": "Default Light",
      "color": {
        "background": "#ffffff",
        "foreground": "#0a0a0a",
        "surface": "#ffffff",
        "surface_foreground": "#0a0a0a",
        "primary": "#171717",
        "primary_foreground": "#fafafa",
        "secondary": "#e5e5e5",
        "secondary_foreground": "#171717",
        "muted": "#f5f5f5",
        "muted_foreground": "#737373",
        "accent": "#f5f5f5",
        "accent_foreground": "#171717",
        "destructive": "#ef4444",
        "destructive_foreground": "#fafafa",
        "border": "#e5e5e5",
        "input": "#e5e5e5",
        "ring": "#a3a3a3",
        "selection": "#55a0fc"
      },
      "spacing": {
        "xxs": 2,
        "xs": 4,
        "sm": 8,
        "md": 12,
        "lg": 16,
        "xl": 24,
        "xxl": 32
      },
      "radius": {
        "none": 0,
        "sm": 3,
        "md": 6,
        "lg": 8,
        "xl": 12,
        "full": 9999
      },
      "typography": {
        "sans": ".SystemUIFont",
        "mono": null,
        "font_size": 16,
        "mono_font_size": 13,
        "xs": { "size": 12, "line_height": 16, "weight": 400 },
        "sm": { "size": 14, "line_height": 20, "weight": 400 },
        "md": { "size": 16, "line_height": 24, "weight": 400 },
        "lg": { "size": 18, "line_height": 28, "weight": 400 },
        "xl": { "size": 20, "line_height": 28, "weight": 400 },
        "mono_md": { "size": 13, "line_height": 20, "weight": 400 }
      },
      "shadow": true
    },
    "dark": {
      "name": "Default Dark",
      "color": {
        "background": "#0a0a0a",
        "foreground": "#fafafa",
        "surface": "#0a0a0a",
        "surface_foreground": "#fafafa",
        "primary": "#fafafa",
        "primary_foreground": "#171717",
        "secondary": "#262626",
        "secondary_foreground": "#fafafa",
        "muted": "#262626",
        "muted_foreground": "#a3a3a3",
        "accent": "#262626",
        "accent_foreground": "#fafafa",
        "destructive": "#f87171",
        "destructive_foreground": "#dc2626",
        "border": "#262626",
        "input": "#2f2f2f",
        "ring": "#737373",
        "selection": "#1d4ed8"
      },
      "spacing": {
        "xxs": 2,
        "xs": 4,
        "sm": 8,
        "md": 12,
        "lg": 16,
        "xl": 24,
        "xxl": 32
      },
      "radius": {
        "none": 0,
        "sm": 3,
        "md": 6,
        "lg": 8,
        "xl": 12,
        "full": 9999
      },
      "typography": {
        "sans": ".SystemUIFont",
        "mono": null,
        "font_size": 16,
        "mono_font_size": 13,
        "xs": { "size": 12, "line_height": 16, "weight": 400 },
        "sm": { "size": 14, "line_height": 20, "weight": 400 },
        "md": { "size": 16, "line_height": 24, "weight": 400 },
        "lg": { "size": 18, "line_height": 28, "weight": 400 },
        "xl": { "size": 20, "line_height": 28, "weight": 400 },
        "mono_md": { "size": 13, "line_height": 20, "weight": 400 }
      },
      "shadow": true
    }
  }
}
